{
 "report_id": "WEEKLY_SSD_20261025",
 "report_type": "country_weekly",
 "title": "重点国家周报（SSD）",
 "country_iso3": "SSD",
 "week_start": "2026-10-18",
 "week_end": "2026-10-25",
 "generated_at": "2026-10-25T07:04:13.080350+08:00",
 "report_timezone": "Asia/Shanghai",
 "executive_assessment": "AI综合研判本次未通过质量门禁，以下仅展示已核验事实与确定性统计信息。",
 "security_trend": "insufficient_data_or_analysis_gate_failed",
 "major_events": [
  {
   "item_id": "EVT_29644fe10092408e",
   "master_event_id": null,
   "country_iso3": "SS?",
   "headline_zh": "Nine killed, six wounded in attacks in Ruweng",
   "fact_summary": "南苏丹鲁旺行政区两处地点遭武装袭击，至少9人死亡、6人受伤，另有数百头牛被抢。鲁旺看守政府指责邻州团结州武装青年所为，但团结州方面表示仍在调查，尚未确认袭击者身份。事件为单一来源报道。",
   "assessment": "该事实已通过确定性核验（来源/归因/不确定性见各字段）。",
   "outlook": "AI 研判见总体分析栏目；本条目不提供独立预测。",
   "verification_status": "single_source",
   "uncertainties": [
    "袭击者身份尚未确认，团结州方面称仍在调查",
    "鲁旺官员关于追击过程中伤亡的说法不明确",
    "事件目前仅有一个来源（Radio Tamazuj）报道，尚缺乏交叉验证"
   ],
   "source_refs": [
    {
     "source_id": "Radio Tamazuj",
     "source_name": "Radio Tamazuj",
     "url": null
    }
   ],
   "latest_update_at": null,
   "importance_score": 50,
   "selection_reasons": [],
   "single_source_warning": true,
   "conflicting": false
  },
  {
   "item_id": "EVT_5674d605edecceaf",
   "master_event_id": null,
   "country_iso3": "SS?",
   "headline_zh": "Governor Rin urges rebels to cease violence and participate in elections",
   "fact_summary": "南苏丹湖泊州看守政府州长林·图尼呼吁在该州活动的武装反对派停止暴力，参加12月22日的和平大选。他在伦拜克举行的看守政府宣誓就职仪式上表示，选举是真实的，所有政党都将拥有政治空间和竞选自由。他提到近期伦拜克镇及周边发生的族群间暴力冲突凸显了不安全挑战。民间社会人士对此表示欢迎，并呼吁确保选举期间的公民和政治空间。",
   "assessment": "该事实已通过确定性核验（来源/归因/不确定性见各字段）。",
   "outlook": "AI 研判见总体分析栏目；本条目不提供独立预测。",
   "verification_status": "single_source",
   "uncertainties": [
    "报道为单一来源（Radio Tamazuj），尚缺乏交叉验证",
    "武装反对派是否响应停火与参选呼吁尚未证实",
    "选举能否如期于12月22日举行尚不确定"
   ],
   "source_refs": [
    {
     "source_id": "Radio Tamazuj",
     "source_name": "Radio Tamazuj",
     "url": null
    }
   ],
   "latest_update_at": null,
   "importance_score": 50,
   "selection_reasons": [],
   "single_source_warning": true,
   "conflicting": false
  },
  {
   "item_id": "EVT_fefa85e6c3b42ea4",
   "master_event_id": null,
   "country_iso3": "SS?",
   "headline_zh": "South Sudan summons Sudan envoy over Abyei market attack",
   "fact_summary": "南苏丹政府表示已召见苏丹驻朱巴大使，就阿卜耶伊争议地区阿米特共同市场遭无人机袭击提出强烈抗议。当地官员将袭击归咎于苏丹武装部队，袭击造成至少73人死亡、19人受伤。阿卜耶伊信息部长称遇难者包括苏丹与南苏丹平民。该地区归属问题自2011年南苏丹独立以来一直悬而未决。",
   "assessment": "该事实已通过确定性核验（来源/归因/不确定性见各字段）。",
   "outlook": "AI 研判见总体分析栏目；本条目不提供独立预测。",
   "verification_status": "single_source",
   "uncertainties": [
    "袭击责任方为当地官员的说法，尚未获得独立证实",
    "伤亡数字为初步统计，尚未获独立核实",
    "目前仅单一来源（Radio Tamazuj）报道，缺乏交叉验证"
   ],
   "source_refs": [
    {
     "source_id": "Radio Tamazuj",
     "source_name": "Radio Tamazuj",
     "url": null
    }
   ],
   "latest_update_at": null,
   "importance_score": 50,
   "selection_reasons": [],
   "single_source_warning": true,
   "conflicting": false
  },
  {
   "item_id": "EVT_10f2ade3652a2c29",
   "master_event_id": null,
   "country_iso3": "SS?",
   "headline_zh": "“We are tired of war”: Women and youth drive peace efforts in Western Equatoria",
   "fact_summary": "南苏丹西赤道州坦布拉地区流离失所的妇女在多年暴力后发起基层和平倡议，走街串巷唱团结歌曲，帮助家庭重建生活。联合国南苏丹特派团（UNMISS）支持相关努力，秘书长特别代表强调持久和平需社区参与。西赤道州看守州长表示将加强安全与预警机制，并帮助青年抵制暴力招募。",
   "assessment": "该事实已通过确定性核验（来源/归因/不确定性见各字段）。",
   "outlook": "AI 研判见总体分析栏目；本条目不提供独立预测。",
   "verification_status": "single_source",
   "uncertainties": [
    "目前仅一个来源（UNMISS）报道，尚缺乏交叉验证"
   ],
   "source_refs": [
    {
     "source_id": "UNMISS",
     "source_name": "UNMISS",
     "url": null
    }
   ],
   "latest_update_at": null,
   "importance_score": 50,
   "selection_reasons": [],
   "single_source_warning": true,
   "conflicting": false
  },
  {
   "item_id": "EVT_8121a880db69b2cd",
   "master_event_id": null,
   "country_iso3": "SS?",
   "headline_zh": "Wau street children transform into agents of change",
   "fact_summary": "More than 70 street children in the Western Bahr el Ghazal State capital, Wau, are The post Wau street children transform into agents of change appeared first on Radio Tamazuj .",
   "assessment": "该事实已通过确定性核验（来源/归因/不确定性见各字段）。",
   "outlook": "AI 研判见总体分析栏目；本条目不提供独立预测。",
   "verification_status": "single_source",
   "uncertainties": [
    "单一来源"
   ],
   "source_refs": [
    {
     "source_id": "Radio Tamazuj",
     "source_name": "Radio Tamazuj",
     "url": null
    }
   ],
   "latest_update_at": null,
   "importance_score": 50,
   "selection_reasons": [],
   "single_source_warning": true,
   "conflicting": false
  },
  {
   "item_id": "EVT_270f403d3fdfb19d",
   "master_event_id": null,
   "country_iso3": "SS?",
   "headline_zh": "Bentiu IDPs protest reported end of WFP food aid",
   "fact_summary": "南苏丹团结州首府本提乌的平民保护点内，流离失所者于周一举行和平抗议，反对世界粮食计划署据报终止粮食援助。抗议者呼吁该机构继续提供援助，警告洪水和降雨不足已限制其耕种能力，弱势家庭可能面临更严重饥荒。营地管理委员会成员称，居民自6月起就担心只有部分社区成员能获得援助。该报道目前为单一来源。",
   "assessment": "该事实已通过确定性核验（来源/归因/不确定性见各字段）。",
   "outlook": "AI 研判见总体分析栏目；本条目不提供独立预测。",
   "verification_status": "single_source",
   "uncertainties": [
    "世界粮食计划署是否已终止粮食援助仅为据报，尚未获官方确认",
    "目前仅单一来源（Radio Tamazuj）报道，尚缺乏交叉验证"
   ],
   "source_refs": [
    {
     "source_id": "Radio Tamazuj",
     "source_name": "Radio Tamazuj",
     "url": null
    }
   ],
   "latest_update_at": null,
   "importance_score": 50,
   "selection_reasons": [],
   "single_source_warning": true,
   "conflicting": false
  },
  {
   "item_id": "EVT_eed5db7c0b07dad0",
   "master_event_id": null,
   "country_iso3": "SS?",
   "headline_zh": "South Sudan to simulate suspected virus case to test emergency response",
   "fact_summary": "南苏丹卫生部宣布，将于10月19日至23日在朱巴、耶伊和扬比奥开展全面模拟演练，模拟发现一例疑似本迪布焦埃博拉病毒病病例，以测试监测、感染防控、患者转运和隔离等应急响应流程。卫生官员强调，此次演练属防范性活动，不应被解读为疫情暴发声明。尼穆莱边境口岸因预算限制未纳入首阶段演练，将考虑在第二阶段进行。",
   "assessment": "该事实已通过确定性核验（来源/归因/不确定性见各字段）。",
   "outlook": "AI 研判见总体分析栏目；本条目不提供独立预测。",
   "verification_status": "single_source",
   "uncertainties": [
    "演练具体预算未公布，官员称资金细节稍后通报",
    "官员未说明跨境人员流动开始的具体日期及人员详情",
    "未提供接受筛查人数或筛查结果数据",
    "官员未表示入境人员已被诊断为本迪布焦病毒病",
    "演练详细日程及结果评估方式未公布"
   ],
   "source_refs": [
    {
     "source_id": "Radio Tamazuj",
     "source_name": "Radio Tamazuj",
     "url": null
    }
   ],
   "latest_update_at": null,
   "importance_score": 50,
   "selection_reasons": [],
   "single_source_warning": true,
   "conflicting": false
  },
  {
   "item_id": "EVT_1b04d78eb77a41f3",
   "master_event_id": null,
   "country_iso3": "SS?",
   "headline_zh": "Governor Tueny launches polio immunization campaign, appeals for peace",
   "fact_summary": "南苏丹湖泊州看守州长林·图埃尼将军与联合国儿童基金会、世界卫生组织等卫生合作伙伴于周一在伦拜克中县马坦盖帕亚姆启动脊髓灰质炎免疫接种活动，目标覆盖367,774名儿童。图埃尼呼吁青年停止无谓的暴力和杀戮，并提及10月8日至9日当地发生的族群间冲突。他要求停止战斗以便调查冲突起因。",
   "assessment": "该事实已通过确定性核验（来源/归因/不确定性见各字段）。",
   "outlook": "AI 研判见总体分析栏目；本条目不提供独立预测。",
   "verification_status": "single_source",
   "uncertainties": [
    "10月8日至9日马坦盖帕亚姆冲突的起因尚未查明，州长要求进行调查",
    "冲突伤亡人数未获确认",
    "该报道为单一来源（Radio Tamazuj），尚缺乏交叉验证"
   ],
   "source_refs": [
    {
     "source_id": "Radio Tamazuj",
     "source_name": "Radio Tamazuj",
     "url": null
    }
   ],
   "latest_update_at": null,
   "importance_score": 50,
   "selection_reasons": [],
   "single_source_warning": true,
   "conflicting": false
  },
  {
   "item_id": "EVT_1f5090169c273070",
   "master_event_id": null,
   "country_iso3": "SS?",
   "headline_zh": "Five killed as security deteriorates in Bor County",
   "fact_summary": "At least five people were killed in two separate attacks at the outskirts of Jonglei The post Five killed as security deteriorates in Bor County appeared first on Radio Tamazuj .",
   "assessment": "该事实已通过确定性核验（来源/归因/不确定性见各字段）。",
   "outlook": "AI 研判见总体分析栏目；本条目不提供独立预测。",
   "verification_status": "single_source",
   "uncertainties": [
    "单一来源"
   ],
   "source_refs": [
    {
     "source_id": "Radio Tamazuj",
     "source_name": "Radio Tamazuj",
     "url": null
    }
   ],
   "latest_update_at": null,
   "importance_score": 50,
   "selection_reasons": [],
   "single_source_warning": true,
   "conflicting": false
  },
  {
   "item_id": "EVT_83435b61890ae553",
   "master_event_id": null,
   "country_iso3": "SS?",
   "headline_zh": "Civil society lauds army crackdown on child trafficking",
   "fact_summary": "南苏丹民间社会活动人士对南苏丹人民国防军持续打击儿童贩运表示欢迎。军方发言人宣布在首都朱巴捣毁一个儿童贩运网络，该团伙近期涉嫌盗窃并贩卖23名儿童，已有8名嫌疑人被捕，其中包括前政府官员，另有在逃人员正被追捕。活动人士指出，儿童绑架在皮博尔大区、琼莱州、东赤道州和中赤道州等地长期普遍存在，与族群冲突、抢牛、道路伏击及执法司法薄弱有关。相关信息目前为单一来源报道。",
   "assessment": "该事实已通过确定性核验（来源/归因/不确定性见各字段）。",
   "outlook": "AI 研判见总体分析栏目；本条目不提供独立预测。",
   "verification_status": "single_source",
   "uncertainties": [
    "案件细节及23名儿童数字目前仅来自军方发言人单方面公布，尚未获得独立交叉验证",
    "目前仅有一个来源（Radio Tamazuj）报道，尚缺乏其他来源佐证"
   ],
   "source_refs": [
    {
     "source_id": "Radio Tamazuj",
     "source_name": "Radio Tamazuj",
     "url": null
    }
   ],
   "latest_update_at": null,
   "importance_score": 50,
   "selection_reasons": [],
   "single_source_warning": true,
   "conflicting": false
  },
  {
   "item_id": "EVT_99dd8a4a86d751de",
   "master_event_id": null,
   "country_iso3": "SS?",
   "headline_zh": "Yei leaders call for joint action against criminal gangs",
   "fact_summary": "Community leaders from four areas in Yei River County have called for urgent joint action The post Yei leaders call for joint action against criminal gangs appeared first on Radio Tamazuj .",
   "assessment": "该事实已通过确定性核验（来源/归因/不确定性见各字段）。",
   "outlook": "AI 研判见总体分析栏目；本条目不提供独立预测。",
   "verification_status": "single_source",
   "uncertainties": [
    "单一来源"
   ],
   "source_refs": [
    {
     "source_id": "Radio Tamazuj",
     "source_name": "Radio Tamazuj",
     "url": null
    }
   ],
   "latest_update_at": null,
   "importance_score": 50,
   "selection_reasons": [],
   "single_source_warning": true,
   "conflicting": false
  },
  {
   "item_id": "EVT_da6a24e2d57d49ab",
   "master_event_id": null,
   "country_iso3": "SS?",